Country,Avatar,Name,Rating,Images,Is Anonymous,Review,Translation Review,Vote Count,Logistics,Sku Info,Date of Published
AO,https://gw.alicdn.com/tps/TB1CjX4LXXXXXbSXFXXXXXXXXXX-240-240.png,F***o,5,,FALSE,"Great product! My kid love it. It’s a bit tricky to fill it up, but not difficult! Loved it!","Great product! My kid love it. It’s a bit tricky to fill it up, but not difficult! Loved it!",0,AliExpress Standard Shipping,Color:Purple Capacity:500ml ,17/07/2025
SG,https://gw.alicdn.com/tps/TB1CjX4LXXXXXbSXFXXXXXXXXXX-240-240.png,J***n,5,,FALSE,,,0,Aliexpress Selection Standard,Color:White Capacity:500ml ,04/06/2025
ES,,X***g,5,,FALSE,,,0,Aliexpress Selection Premium shipping,Color:Purple Capacity:500ml ,04/09/2025
US,,G***a,5,,FALSE,,,0,Aliexpress Selection Standard,Color:Blue Capacity:500ml ,13/09/2025
US,,s***o,4,,FALSE,All good anda fast ,All good anda fast,0,Aliexpress Selection Standard,Color:Blue Capacity:500ml ,20/09/2025
US,https://ae01.alicdn.com/kf/Abb367c25fee14c0884fb837b210d9193c.jpg_220x220.jpg,v***e,5,"https://ae01.alicdn.com/kf/Acec2af6c22784972ab1a272fd7fc96b6W.jpg,
https://ae01.alicdn.com/kf/A41c524ca52f742f49adc410692917af2v.jpg",FALSE,it took so long to get here because I ordered during the tariffs but it came after a month and works perfectly, works perfectly,0,Aliexpress Selection Standard,Color:Pink Capacity:500ml ,23/06/2025
ES,,AliExpress Shopper,5,,TRUE,,,0,Aliexpress Selection Premium shipping,Color:Blue Capacity:500ml ,24/10/2025
AT,https://ae01.alicdn.com/kf/U0384740c4f2c44a19407b1637f0c46dc2.jpg_220x220.jpg,К***а,5,,FALSE,,,0,Aliexpress Selection Standard,Color:Blue Capacity:500ml ,11/08/2025
IL,,AliExpress Shopper,5,,TRUE,,,0,Aliexpress Selection Standard,Color:Purple Capacity:500ml ,18/08/2025
UA,,AliExpress Shopper,5,,TRUE,,,0,Aliexpress Selection Premium shipping,Color:Blue Capacity:500ml ,21/08/2025
RU,https://ae01.alicdn.com/kf/A502161f964894fecb96336fefa3f5a56p.png_220x220.png,B***y,5,,FALSE,,,0,AliExpress Standard Shipping,Color:Pink Capacity:500ml ,14/08/2025
IL,https://ae01.alicdn.com/kf/A8cc773ebfdac48ca9659fc4b92410c837.jpg_220x220.jpg,S***r,5,,FALSE,בקבוק מקסים הנכדה התלהבה כל כך שלא מוכנה ללכת עם בקבוק אחר,"A lovely bottle, the granddaughter is so enthusiastic that she is not ready to go with another bottle.",0,Aliexpress Selection Standard,Color:Pink Capacity:500ml ,27/09/2025
IT,https://ae01.alicdn.com/kf/Acc57776b6f1744059101ac06787dd1263.jpg_220x220.jpg,m***o,4,,FALSE,,,0,Aliexpress Selection Standard,Color:Blue Capacity:500ml ,18/10/2025
KH,,AliExpress Shopper,4,,TRUE,,,0,Cainiao Standard For Special Goods,Color:Blue Capacity:500ml ,06/09/2025
UK,https://ae01.alicdn.com/kf/A50a5cdff3f874615a305fa7e8415e424c.jpg_220x220.jpg,Л***а,5,,FALSE,,,0,Aliexpress Selection Premium shipping,Color:Blue Capacity:500ml ,24/05/2025
KR,,AliExpress Shopper,5,,TRUE,,,0,Aliexpress Selection Premium shipping,Color:Blue Capacity:500ml ,04/10/2025
UK,,AliExpress Shopper,5,,TRUE,,,0,Aliexpress Selection Premium shipping,Color:Blue Capacity:500ml ,16/10/2025
FR,,1***r,5,,FALSE,très belle gourde,very beautiful water bottle,0,Aliexpress Selection Standard,Color:Pink Capacity:500ml ,07/09/2025
ES,,M***l,5,,FALSE,"Tal cual como en la publicidad, me encantó","Just as advertised, I loved it.",0,Aliexpress Selection Premium shipping,Color:White Capacity:500ml ,29/08/2025
IL,https://ae01.alicdn.com/kf/A8cc773ebfdac48ca9659fc4b92410c837.jpg_220x220.jpg,S***r,5,,FALSE,גימיק נהדר,Great gimmick,0,Aliexpress Selection Standard,Color:Blue Capacity:500ml ,27/09/2025
