Country,Avatar,Name,Rating,Images,Is Anonymous,Review,Translation Review,Vote Count,Logistics,Sku Info,Date of Published
MX,https://ae01.alicdn.com/kf/Abd388f1fe2424803a07e7f74226e82b7s.jpg_220x220.jpg,G***a,5,https://ae01.alicdn.com/kf/Aef52615433f74c2495057f34dd0ecf1el.jpg,FALSE,Very cute and entertaining for the little ones. I recommend it to the 100!!,Very cute and entertaining for the little ones. I recommend it to the 100!!,0,Aliexpress Selection Standard,Color:1pcs Blue ,11/10/2024
US,https://ae01.alicdn.com/kf/Acc1f9a06a25443f5887f27af9df83d5ee.jpg_220x220.jpg,S***z,5,https://ae01.alicdn.com/kf/A9cc00f12832e4900898ec51baac3fbd1s.jpg,FALSE,"Very cute, very vivid color. My daughter loves it.","Very cute, very vivid color. My daughter loves it.",0,Aliexpress Selection Standard,Color:1pcs Purple ,27/09/2024
US,https://gw.alicdn.com/tps/TB1CjX4LXXXXXbSXFXXXXXXXXXX-240-240.png,f***A,5,,FALSE,very cool toy. great,very cool toy. great,0,Aliexpress Selection Standard,Color:1pcs Pink ,10/10/2024
US,,a***r,5,,FALSE,,,0,Aliexpress Selection Standard,Color:1pcs Yellow ,18/11/2024
US,,R***k,5,,FALSE,my children are crazy over this prize!!!!!!,my children are crazy over this prize!!!!!!,0,Aliexpress Selection Standard,Color:1pcs Blue ,19/11/2024
US,https://gw.alicdn.com/tps/TB1zA01LXXXXXc0XFXXXXXXXXXX-240-240.png,A***h,5,,FALSE,The product meets my expectations. The quality is high. The package was well packed and the parcel arrived very quickly. I recommend🙂,The product meets my expectations. The quality is high. The package was well packed and the parcel arrived very quickly. I recommend🙂,0,Aliexpress Selection Standard,Color:1pcs Pink ,21/11/2024
