Country,Avatar,Name,Rating,Images,Is Anonymous,Review,Translation Review,Vote Count,Logistics,Sku Info,Date of Published
CO,https://ae01.alicdn.com/kf/Aa4cc219cd7994b838feba389fca8b527O.jpg_220x220.jpg,E***o,5,https://ae01.alicdn.com/kf/A83a3897d8378476b8ddb7b8d67ff536fS.jpg,FALSE,"me gustó bastante ,a pesar que la tela es sencilla no es sintética es algodón, lo demás está perfecto, muchas gracias ,lo recomiendo","I liked it quite, although the fabric is simple, it is not synthetic, it is cotton, the rest is perfect, thank you very much, I recommend it",0,Cainiao Super Economy Global,Color:DP crocodile Kid Size:6M ,20/10/2024
US,https://ae01.alicdn.com/kf/Ae26c5ee1842148889292d4b7411b1858v.jpg_220x220.jpg,l***a,5,,FALSE,Lindo y el material súper ,Cute and super material,0,Aliexpress Selection Standard,Color:DP DeepBlue dinosaur Kid Size:12M ,28/10/2024
US,,AliExpress Shopper,5,,TRUE,,,0,Cainiao Super Economy Global,Color:DP DeepBlue dinosaur Kid Size:6M ,02/03/2025
CL,,M***a,5,,FALSE,muy buen producto y excelente calidad,Very good product and excellent quality,0,Aliexpress Selection Standard,Color:DP DeepBlue dinosaur Kid Size:18M ,22/10/2024
MX,,AliExpress Shopper,5,,TRUE,Muy bueno y súper rápido la entrega ,Very good and super fast delivery,0,Aliexpress Selection Standard,Color:DP DeepBlue dinosaur Kid Size:3M ,21/10/2024
CL,https://ae01.alicdn.com/kf/UTB8RZs4u4HEXKJk43Jeq6yeeXXa8.jpg_220x220.jpg,P***p,5,,FALSE,"Excelente calidad, hermoso","Excellent quality, beautiful",0,Aliexpress Selection Standard,Color:DP DeepBlue dinosaur Kid Size:12M ,31/10/2024
PK,https://ae01.alicdn.com/kf/S23ff0fac07964135aa2d51787e0a1c8di.jpg_220x220.jpg,D***i,5,,FALSE,"Fast delivery, good quality","Fast delivery, good quality",0,Aliexpress Selection Standard,Color:DP DeepBlue dinosaur Kid Size:6M ,16/10/2024
CL,https://ae01.alicdn.com/kf/U5542c4326e3948918c47a8ad109180337.jpg_220x220.jpg,R***z,5,,FALSE,"Buen producto,llegó bien","Good product, well received",0,Aliexpress Selection Standard,Color:DP gentleman black Kid Size:6M ,22/02/2025
KR,https://ae01.alicdn.com/kf/A381a5b655a534f16bde8b878ef317d3ag.jpg_220x220.jpg,H***h,5,,FALSE,,,0,AliExpress Saver Shipping,Color:DP GreenStrap Dragon Kid Size:6M ,29/12/2024
PE,,e***r,5,https://ae01.alicdn.com/kf/A7d28a266361543368768740197ee4396b.jpg,FALSE,"muy lindo, muy colorido , la tela es muy suave, delgada ideal para verano , llegó muchísimo antes de la fecha indicada","Very cute, very colorful, the fabric is very soft, thin ideal for summer, arrived very much before the indicated date",0,Aliexpress Selection Standard,Color:DP DeepBlue dinosaur Kid Size:24M ,28/11/2024
SG,,K***N,5,,FALSE,,,0,Aliexpress Selection Standard,Color:DP crocodile Kid Size:6M ,16/01/2025
CL,https://ae01.alicdn.com/kf/U2387749fe47d4fd6885a74fad3709cdfO.jpg_220x220.jpg,C***d,5,,FALSE,mas hermoso de lo que pensé a mi bebe le quedó bello y la entrega fue antes de tiempo,More beautiful than I thought my baby was beautiful and the delivery was ahead of time,0,Aliexpress Selection Standard,Color:DP crocodile Kid Size:3M ,08/01/2025
CL,https://ae01.alicdn.com/kf/UTB8tBQTDOaMiuJk43PTq6ySmXXaJ.jpg_220x220.jpg,g***l,5,,FALSE,hermoso!!!!,Beautiful!!!!,0,Aliexpress Selection Standard,Color:DP DeepBlue dinosaur Kid Size:18M ,13/11/2024
MX,https://ae01.alicdn.com/kf/UTB8zOllqSbIXKJkSaefq6yasXXaa.jpg_220x220.jpg,B***o,5,https://ae01.alicdn.com/kf/Ac510f16020c64736909a9e901469119ba.jpg,FALSE,,,0,Aliexpress Selection Standard,Color:DP DeepBlue dinosaur Kid Size:24M ,03/03/2025
