Country,Avatar,Name,Rating,Images,Is Anonymous,Review,Translation Review,Vote Count,Logistics,Sku Info,Date of Published
TN,https://ae01.alicdn.com/kf/A1cfa5464873d47d2a53418d3c4f3bdf13.jpg_220x220.jpg,H***h,5,https://ae01.alicdn.com/kf/A600dbd15cea34dae88a1cec31902c8fb0.jpg,FALSE,I got there on time. Thanks.,I got there on time. Thanks.,0,Cainiao Super Economy Global,Color:S 2-6Y Green ,27/08/2024
DZ,https://ae01.alicdn.com/kf/A4e623c4ce1f24dbd8b137043bf4d262dr.jpg_220x220.jpg,G***i,5,,FALSE,Sweet,Sweet,0,Cainiao Super Economy Global,Color:M 6-12Y Purple ,21/08/2024
LK,,AliExpress Shopper,5,,TRUE,good and my baby like it soo much,good and my baby like it soo much,0,AliExpress Saver Shipping,Color:M 6-12Y Purple ,24/07/2024
MU,,AliExpress Shopper,4,,TRUE,well received satisfied with the product,well received satisfied with the product,0,Cainiao Super Economy Global,Color:S 2-6Y Blue ,21/10/2024
LK,,L***d,5,,FALSE,Useful ,Useful ,0,AliExpress Saver Shipping,Color:S 2-6Y Purple ,03/08/2024
LK,,AliExpress Shopper,5,,TRUE,supper,supper,0,AliExpress Saver Shipping,Color:S 2-6Y Purple ,06/08/2024
DZ,https://ae01.alicdn.com/kf/Acf5bcec9c6304b0e851fedae845f4921w.jpg_220x220.jpg,خ***ة,5,https://ae01.alicdn.com/kf/Ae1633e3928f84e76afcb2759dc9c1572r.jpg,FALSE,,,0,Cainiao Super Economy Global,Color:S 2-6Y Blue ,29/09/2024
MA,https://ae01.alicdn.com/kf/A437347811e044175a34349cc43a40e70k.jpg_220x220.jpg,c***c,5,,FALSE,,,0,Cainiao Super Economy Global,Color:S 2-6Y Pink ,01/01/2025
LK,https://ae01.alicdn.com/kf/Ab0bcdf6a59154027ae9611ecc692d9d37.jpg_220x220.jpg,J***i,5,,FALSE,Nice,Nice,0,AliExpress Saver Shipping,Color:S 2-6Y Purple ,07/12/2024
