Country,Avatar,Name,Rating,Images,Is Anonymous,Review,Translation Review,Vote Count,Logistics,Sku Info,Date of Published
UA,,AliExpress Shopper,5,https://ae01.alicdn.com/kf/Ac11ef4eea2294f7a882af247b0f6d1a0x.jpg,TRUE,Thank you! Children play with pleasure. My husband and I are also competing. Very develops attention and patience.,Thank you! Children play with pleasure. My husband and I are also competing. Very develops attention and patience.,0,Aliexpress Selection Standard,Color:2 SET-WITH BELL ,10/08/2024
CO,https://ae01.alicdn.com/kf/Ad14647bfe9734a75845e355dd0cb5507V.jpg_220x220.jpg,F***A,5,https://ae01.alicdn.com/kf/Ab32c43ec2d744767ad69971daf6cfdb2K.jpg,FALSE,"Excellent product, very fun, children love it. I'll buy more. Thank you seller, highly recommended😀","Excellent product, very fun, children love it. I'll buy more. Thank you seller, highly recommended😀",0,AliExpress Standard Shipping,Color:2 SET-WITH BELL ,06/07/2024
UA,https://ae01.alicdn.com/kf/Ab372309eb36947a3baa1d9f78df6b018F.jpg_220x220.jpg,О***ь,5,https://ae01.alicdn.com/kf/A74631ae73e884174a34f6509e68dd132f.jpg,FALSE,love it very nice game,love it very nice game,0,Aliexpress Selection Standard,Color:1 SET-AS SHOW ,28/06/2024
PL,,m***r,5,,FALSE,"Cool game, too bad it doesn't have a box. Fast shipping. Thank you seller.","Cool game, too bad it doesn't have a box. Fast shipping. Thank you seller.",0,Aliexpress Selection Standard,Color:2 SET-WITH BELL ,15/07/2024
PE,https://ae01.alicdn.com/kf/A528ae4617996483685301bcf0819b273B.jpg_220x220.jpg,K***i,5,,FALSE,"My son loves it, as is the description!! I would buy it again","My son loves it, as is the description!! I would buy it again",0,Aliexpress Selection Standard,Color:1 SET-AS SHOW ,30/07/2024
UA,,AliExpress Shopper,5,,TRUE,,,0,Aliexpress Selection Standard,Color:1 SET-AS SHOW ,25/06/2024
